<xsd:schema xmlns:xsd="http://www.w3.org/2001/XMLSchema" xmlns:bks="urn:books" targetNamespace="urn:books">
    <xsd:element name="books" type="bks:BooksForm"/>
    <xsd:complexType name="BooksForm">
        <xsd:sequence>
            <xsd:element name="book" type="bks:BookForm" minOccurs="0" maxOccurs="unbounded"/>
        </xsd:sequence>
    </xsd:complexType>
    <xsd:complexType name="BookForm">
        <xsd:sequence>
            <xsd:element name="author" type="xsd:string"/>
            <xsd:element name="title" type="xsd:string"/>
            <xsd:element name="genre" type="xsd:string"/>
            <xsd:element name="price" type="xsd:float"/>
            <xsd:element name="pub_date" type="xsd:dateTime" minOccurs="0"/>
            <xsd:choice maxOccurs="unbounded">
                <xsd:element name="review" type="xsd:string"/>
                <xsd:element name="alias" type="bks:AliasType"/>
                <xsd:element name="website" type="bks:WebsiteType"/>
            </xsd:choice>
        </xsd:sequence>
        <xsd:attribute name="id" type="xsd:string"/>
    </xsd:complexType>
    <xsd:complexType name="AliasType">
        <xsd:sequence>
            <xsd:element name="alias_name" type="xsd:string" minOccurs="0" maxOccurs="unbounded"/>
        </xsd:sequence>
    </xsd:complexType>
    <xsd:complexType name="WebsiteType">
        <xsd:sequence>
            <xsd:element name="web_url" type="xsd:string" minOccurs="0" maxOccurs="unbounded"/>
        </xsd:sequence>
    </xsd:complexType>
</xsd:schema>
